{
  "required" : true ,
  "$schema" : "http://json-schema.org/draft-03/schema" ,
  "type" : "object" ,
  "properties" : {
    "total_count" : {
      "type" : "number" ,
      "required" : false
    } ,
    "has_more" : {
      "type" : "boolean" ,
      "required" : false
    } ,
    "object" : {
      "type" : "string" ,
      "required" : false
    } ,
    "data" : {
      "type" : "array" ,
      "required" : false ,
      "items" : [
        {
          "type" : "object" ,
          "properties" : {
            "object" : {
              "type" : "string" ,
              "required" : false
            } ,
            "id" : {
              "type" : "string" ,
              "required" : false
            } ,
            "created_at" : {
              "type" : "number" ,
              "required" : false
            } ,
            "updated_at" : {
              "type" : "number" ,
              "required" : false
            } ,
            "livemode" : {
              "type" : "boolean" ,
              "required" : false
            } ,
            "person_id" : {
              "type" : "string" ,
              "required" : false
            } ,
            "score" : {
              "type" : "number" ,
              "required" : false
            } ,
            "expired" : {
              "type" : "boolean" ,
              "required" : false
            } ,
            "time_limit" : {
              "type" : "number" ,
              "required" : false
            } ,
            "questions" : {
              "type" : "array" ,
              "required" : false ,
              "items" : [
                {
                  "type" : "object" ,
                  "properties" : {
                    "id" : {
                      "type" : "number" ,
                      "required" : false
                    } ,
                    "question" : {
                      "type" : "string" ,
                      "required" : false
                    } ,
                    "answers" : {
                      "type" : "array" ,
                      "required" : false ,
                      "items" : [
                        {
                          "type" : "object" ,
                          "properties" : {
                            "id" : {
                              "type" : "number" ,
                              "required" : false
                            } ,
                            "answer" : {
                              "type" : "string" ,
                              "required" : false
                            }
                          }
                        }
                      ]
                    }
                  }
                }
              ]
            }
          }
        }
      ]
    }
  }
}